{"artifactRef":{"bundleDigest":"sha256:e006520961ce3ae2ff2322f1c8179bb8ba6636c5851243ed591ee96e44b67e77","projectionDigest":"sha256:c82da1ca9c2c6c1a2497c7daa315db6104c26a53cff34411f6fefc00a9f15893","runId":"aleph-mlx-canary-001","schemaVersion":"aleph-artifact-ref/0.1.0"},"candidates":[{"compression":0.105263,"fit":1,"id":"sha256:e825eccb6f7104b9184bcd1cdfa850f7d61bddd609fccad429af4ef9e3537a55","label":"Seed","leakage":0,"output":"21 + 21 = 42","prompt":"user: Compute twenty-one plus twenty-one.\n\nuser: Reply with only the digits.","stability":1,"tokens":17},{"compression":0.090909,"fit":1,"id":"sha256:8855c4177db40c391b2542217b3fb12c54fe1f071b793caec6df254b6e5dc45f","label":"Seed","leakage":0,"output":"42","prompt":"user: Find the integer between forty-one and forty-three.\n\nuser: Reply with only that number.","stability":1,"tokens":20},{"compression":0.066667,"fit":1,"id":"sha256:c6a0d4bcf57bf7de8837a154cd5fd5e9cba2bcd258da1cf56023d915f1e1cbbc","label":"Reference","leakage":0,"output":"42","prompt":"user: Find the integer between forty-one and forty-three.\n\nuser: Reply with only that number.\n\nuser: Reply with only the digits.","stability":1,"tokens":28},{"compression":0.222222,"fit":1,"id":"sha256:0ecfd39ac793ef07f09bb3aef692cb0d1ba42d0b48ccd30eecf22e7eea6ec842","label":"Delete","leakage":0,"output":"Twenty-one plus twenty-one is:\n\n**21 + 21 = 42**\n\nLet me know if you need help with anything else! 😊","prompt":"Compute twenty-one plus twenty-one.","stability":1,"tokens":7}],"config":{"budget":{"candidates":4,"maxPromptTokens":28,"repeatedSamples":2},"decoding":"{\"addGenerationPrompt\":true,\"enableThinking\":false,\"maxNewTokens\":64,\"samplesPerEvaluation\":2,\"temperature\":0}","metric":"fit","mode":"unrestricted","model":"mlx-community/Qwen3-1.7B-4bit@3b1b1768f8f8cf8351c712464f906e86c2b8269e"},"createdAt":"2026-10-15T11:21:00Z","id":"aleph-mlx-canary-001","observations":{"mode":"black_box"},"selectedCandidateId":"sha256:0ecfd39ac793ef07f09bb3aef692cb0d1ba42d0b48ccd30eecf22e7eea6ec842","target":{"text":"42"}}
